employee_id,asset_id,assigned_date,return_date,location,status,condition,serial_number,model_number,warranty_expiration,maintenance_schedule,maintenance_last_date,maintenance_next_date
85,28,11/19/2022,3/4/2022,office,inactive,used,elementum eu interdum eu tincidunt in leo maecenas pulvinar lobortis est phasellus sit amet erat nulla,justo lacinia eget tincidunt eget tempus vel pede morbi porttitor lorem id ligula suspendisse ornare,10/11/2025,annually,9/7/2022,9/17/2022
29,30,12/14/2022,4/10/2021,warehouse,inactive,refurbished,aliquam quis turpis eget elit sodales scelerisque mauris sit amet eros suspendisse accumsan tortor,duis aliquam convallis nunc proin at turpis a pede posuere nonummy integer non,8/25/2023,annually,9/21/2020,5/5/2021
41,38,7/24/2021,7/7/2021,remote,pending,refurbished,velit nec nisi vulputate nonummy maecenas tincidunt lacus at velit vivamus vel nulla eget eros elementum pellentesque quisque,nisl ut volutpat sapien arcu sed augue aliquam erat volutpat in congue,7/9/2022,annually,3/13/2021,1/20/2021
17,61,8/22/2021,4/17/2022,remote,inactive,used,nullam orci pede venenatis non sodales sed tincidunt eu felis fusce posuere felis sed lacus morbi sem mauris laoreet,consequat in consequat ut nulla sed accumsan felis ut at dolor quis odio consequat varius integer ac leo pellentesque ultrices,1/23/2029,monthly,1/26/2020,10/28/2020
56,23,7/29/2021,4/8/2022,office,inactive,new,donec pharetra magna vestibulum aliquet ultrices erat tortor sollicitudin mi sit amet lobortis sapien sapien non mi integer ac,sed nisl nunc rhoncus dui vel sem sed sagittis nam congue risus semper,2/17/2028,quarterly,10/22/2021,9/22/2021
2,36,10/16/2021,9/2/2022,remote,inactive,refurbished,nascetur ridiculus mus vivamus vestibulum sagittis sapien cum sociis natoque,orci mauris lacinia sapien quis libero nullam sit amet turpis elementum,4/28/2023,quarterly,8/16/2021,1/18/2021
58,61,6/30/2022,5/7/2022,warehouse,inactive,new,tortor risus dapibus augue vel accumsan tellus nisi eu orci mauris,sapien a libero nam dui proin leo odio porttitor id consequat in consequat ut nulla sed accumsan felis ut at,3/1/2030,monthly,3/8/2022,12/28/2020
78,12,3/1/2020,9/28/2021,remote,active,used,duis faucibus accumsan odio curabitur convallis duis consequat dui nec nisi,risus semper porta volutpat quam pede lobortis ligula sit amet eleifend,2/18/2022,quarterly,8/24/2022,2/25/2021
33,95,3/20/2022,4/29/2021,remote,active,used,ligula in lacus curabitur at ipsum ac tellus semper interdum mauris ullamcorper purus sit amet nulla,nibh quisque id justo sit amet sapien dignissim vestibulum vestibulum ante ipsum primis in faucibus,8/28/2023,quarterly,3/15/2022,2/18/2020
69,52,12/16/2020,12/14/2022,warehouse,active,refurbished,dui nec nisi volutpat eleifend donec ut dolor morbi vel lectus in quam fringilla rhoncus mauris enim,nunc rhoncus dui vel sem sed sagittis nam congue risus semper porta volutpat,11/15/2026,annually,7/19/2021,10/9/2021
48,58,10/30/2022,9/25/2020,remote,inactive,new,faucibus orci luctus et ultrices posuere cubilia curae mauris viverra diam vitae quam suspendisse potenti nullam porttitor lacus at turpis,mi integer ac neque duis bibendum morbi non quam nec dui luctus rutrum nulla tellus in sagittis dui vel nisl,12/20/2025,monthly,5/17/2021,6/23/2021
42,98,12/9/2022,9/21/2022,office,active,new,sapien sapien non mi integer ac neque duis bibendum morbi non quam nec dui,vestibulum sed magna at nunc commodo placerat praesent blandit nam nulla integer pede justo lacinia eget tincidunt eget tempus,9/2/2028,monthly,1/12/2020,3/9/2020
62,8,4/20/2021,7/27/2022,warehouse,pending,refurbished,sed tristique in tempus sit amet sem fusce consequat nulla nisl nunc nisl duis bibendum,erat eros viverra eget congue eget semper rutrum nulla nunc purus phasellus in felis,1/21/2025,monthly,8/11/2022,3/4/2020
39,19,3/23/2020,8/3/2020,warehouse,active,new,suspendisse potenti cras in purus eu magna vulputate luctus cum sociis natoque penatibus et magnis dis parturient montes nascetur,sapien a libero nam dui proin leo odio porttitor id,3/1/2027,annually,8/7/2021,5/2/2022
68,81,6/27/2022,7/23/2022,warehouse,pending,new,faucibus orci luctus et ultrices posuere cubilia curae donec pharetra,luctus et ultrices posuere cubilia curae mauris viverra diam vitae quam suspendisse potenti nullam,12/28/2022,monthly,5/7/2022,6/30/2022
88,29,3/30/2021,3/16/2022,office,inactive,new,in lectus pellentesque at nulla suspendisse potenti cras in purus eu magna vulputate luctus cum sociis,mi in porttitor pede justo eu massa donec dapibus duis,4/29/2022,monthly,12/21/2021,7/11/2020
82,63,2/27/2020,9/4/2021,office,active,refurbished,dictumst maecenas ut massa quis augue luctus tincidunt nulla mollis molestie lorem,turpis elementum ligula vehicula consequat morbi a ipsum integer a nibh in quis justo maecenas rhoncus,8/30/2022,monthly,3/1/2020,10/3/2020
59,8,7/22/2022,6/19/2022,warehouse,active,new,pellentesque viverra pede ac diam cras pellentesque volutpat dui maecenas tristique est et tempus,urna ut tellus nulla ut erat id mauris vulputate elementum nullam varius nulla facilisi cras non velit nec nisi vulputate,8/21/2028,quarterly,9/25/2020,7/16/2022
56,38,2/3/2021,12/8/2020,remote,active,used,a ipsum integer a nibh in quis justo maecenas rhoncus aliquam lacus morbi quis,velit donec diam neque vestibulum eget vulputate ut ultrices vel augue,9/24/2029,quarterly,2/9/2022,7/3/2022
5,33,3/11/2020,8/27/2020,remote,pending,new,sapien arcu sed augue aliquam erat volutpat in congue etiam justo etiam pretium iaculis justo in hac,primis in faucibus orci luctus et ultrices posuere cubilia curae mauris viverra diam vitae quam,1/15/2025,quarterly,5/31/2020,10/10/2021
51,65,8/12/2022,7/10/2020,warehouse,inactive,refurbished,cras mi pede malesuada in imperdiet et commodo vulputate justo in blandit ultrices enim,nunc vestibulum ante ipsum primis in faucibus orci luctus et ultrices posuere cubilia curae mauris viverra diam,10/10/2023,monthly,4/13/2022,8/2/2021
13,40,11/28/2022,12/30/2020,warehouse,pending,new,euismod scelerisque quam turpis adipiscing lorem vitae mattis nibh ligula nec sem duis,ipsum aliquam non mauris morbi non lectus aliquam sit amet diam in magna bibendum imperdiet nullam orci,2/17/2027,monthly,10/20/2020,7/8/2022
93,90,11/28/2020,5/4/2020,warehouse,pending,used,nulla sed vel enim sit amet nunc viverra dapibus nulla suscipit ligula in lacus curabitur,turpis enim blandit mi in porttitor pede justo eu massa donec dapibus duis at velit eu est,2/28/2028,annually,12/7/2020,7/15/2020
6,52,3/24/2020,3/19/2020,office,active,new,nibh quisque id justo sit amet sapien dignissim vestibulum vestibulum ante ipsum primis in faucibus,morbi ut odio cras mi pede malesuada in imperdiet et commodo vulputate justo in blandit ultrices enim lorem ipsum dolor,6/19/2022,quarterly,12/15/2021,10/5/2020
41,78,6/23/2022,9/1/2022,remote,active,new,sit amet sem fusce consequat nulla nisl nunc nisl duis bibendum felis sed interdum,quis orci eget orci vehicula condimentum curabitur in libero ut massa volutpat convallis morbi odio odio elementum eu interdum,7/8/2022,annually,8/28/2020,5/6/2021
54,76,1/3/2020,1/5/2022,remote,active,used,est lacinia nisi venenatis tristique fusce congue diam id ornare imperdiet sapien,congue risus semper porta volutpat quam pede lobortis ligula sit amet eleifend pede libero quis orci nullam,1/13/2025,monthly,1/2/2022,3/26/2020
31,37,3/31/2022,10/27/2021,remote,active,used,volutpat convallis morbi odio odio elementum eu interdum eu tincidunt in leo maecenas pulvinar lobortis,dapibus duis at velit eu est congue elementum in hac habitasse platea dictumst morbi vestibulum velit,2/1/2029,monthly,8/31/2020,10/19/2020
13,94,9/27/2020,1/21/2021,office,inactive,refurbished,orci vehicula condimentum curabitur in libero ut massa volutpat convallis morbi,augue a suscipit nulla elit ac nulla sed vel enim sit amet nunc viverra dapibus,4/13/2024,quarterly,7/13/2020,10/4/2022
54,74,2/5/2022,7/21/2020,office,active,used,mauris morbi non lectus aliquam sit amet diam in magna bibendum imperdiet nullam,elit proin interdum mauris non ligula pellentesque ultrices phasellus id sapien,8/3/2026,quarterly,3/20/2021,2/9/2022
57,74,3/28/2021,2/18/2020,remote,pending,new,vestibulum sed magna at nunc commodo placerat praesent blandit nam nulla integer pede justo lacinia eget tincidunt eget tempus vel,quis orci eget orci vehicula condimentum curabitur in libero ut massa volutpat convallis morbi odio odio elementum eu interdum eu,4/3/2030,annually,4/10/2020,2/1/2021
11,29,3/22/2022,7/4/2022,office,inactive,new,sit amet diam in magna bibendum imperdiet nullam orci pede venenatis non,maecenas ut massa quis augue luctus tincidunt nulla mollis molestie lorem quisque ut erat curabitur gravida,7/15/2027,monthly,11/26/2021,6/29/2020
77,1,8/1/2020,5/24/2022,office,pending,used,nam nulla integer pede justo lacinia eget tincidunt eget tempus vel pede morbi porttitor,elit ac nulla sed vel enim sit amet nunc viverra dapibus nulla suscipit ligula in lacus curabitur at ipsum,3/29/2027,annually,5/25/2022,8/13/2022
14,93,12/3/2022,10/26/2021,remote,inactive,used,etiam vel augue vestibulum rutrum rutrum neque aenean auctor gravida sem praesent id massa id nisl,iaculis justo in hac habitasse platea dictumst etiam faucibus cursus urna ut tellus nulla ut erat id mauris vulputate elementum,8/12/2026,quarterly,6/8/2022,2/3/2022
71,45,12/11/2021,9/1/2020,remote,pending,used,facilisi cras non velit nec nisi vulputate nonummy maecenas tincidunt lacus at velit vivamus vel nulla eget eros,est phasellus sit amet erat nulla tempus vivamus in felis eu sapien cursus vestibulum proin eu mi,12/6/2029,quarterly,1/5/2020,10/28/2020
99,74,12/29/2021,11/20/2021,remote,inactive,refurbished,interdum eu tincidunt in leo maecenas pulvinar lobortis est phasellus sit amet erat,in hac habitasse platea dictumst aliquam augue quam sollicitudin vitae consectetuer eget,2/23/2028,annually,6/22/2021,12/30/2021
76,73,4/8/2020,7/31/2021,remote,active,refurbished,rhoncus aliquam lacus morbi quis tortor id nulla ultrices aliquet maecenas leo,in tempus sit amet sem fusce consequat nulla nisl nunc nisl duis bibendum felis sed interdum venenatis turpis enim blandit,5/5/2028,monthly,2/21/2022,6/4/2021
41,13,12/2/2020,4/30/2021,remote,inactive,new,venenatis turpis enim blandit mi in porttitor pede justo eu massa donec dapibus duis at velit eu est congue,pharetra magna ac consequat metus sapien ut nunc vestibulum ante ipsum primis in faucibus orci,7/20/2027,quarterly,11/7/2022,7/27/2021
70,2,8/31/2020,1/7/2021,warehouse,inactive,new,erat id mauris vulputate elementum nullam varius nulla facilisi cras non velit,aliquet at feugiat non pretium quis lectus suspendisse potenti in eleifend quam a odio in hac,8/26/2029,quarterly,11/7/2022,6/13/2022
66,93,6/5/2021,2/16/2021,warehouse,pending,new,id turpis integer aliquet massa id lobortis convallis tortor risus dapibus augue vel accumsan tellus nisi,in sagittis dui vel nisl duis ac nibh fusce lacus purus aliquet at feugiat non pretium quis lectus,2/11/2030,monthly,7/10/2022,5/4/2020
22,38,10/23/2022,1/29/2021,office,inactive,new,felis fusce posuere felis sed lacus morbi sem mauris laoreet ut rhoncus aliquet pulvinar sed nisl nunc rhoncus dui,luctus et ultrices posuere cubilia curae duis faucibus accumsan odio curabitur convallis duis consequat dui nec,11/12/2022,monthly,11/19/2022,10/5/2020
69,31,1/2/2021,1/5/2020,remote,active,used,odio donec vitae nisi nam ultrices libero non mattis pulvinar nulla pede ullamcorper augue,urna pretium nisl ut volutpat sapien arcu sed augue aliquam,9/29/2026,monthly,8/5/2022,11/11/2021
38,48,12/21/2021,10/28/2020,office,inactive,refurbished,sed magna at nunc commodo placerat praesent blandit nam nulla integer pede justo lacinia eget tincidunt eget tempus vel,enim leo rhoncus sed vestibulum sit amet cursus id turpis integer aliquet,10/9/2025,annually,12/31/2021,8/14/2020
50,94,2/9/2022,9/26/2021,office,active,refurbished,donec ut mauris eget massa tempor convallis nulla neque libero convallis eget eleifend luctus ultricies,vel enim sit amet nunc viverra dapibus nulla suscipit ligula in lacus curabitur at ipsum,4/23/2029,annually,8/29/2020,2/27/2021
22,100,3/5/2020,3/19/2021,remote,active,refurbished,faucibus cursus urna ut tellus nulla ut erat id mauris vulputate elementum nullam varius nulla facilisi cras non velit nec,pellentesque eget nunc donec quis orci eget orci vehicula condimentum curabitur,6/19/2023,annually,2/3/2021,7/20/2020
84,10,8/8/2020,7/3/2021,office,inactive,refurbished,a feugiat et eros vestibulum ac est lacinia nisi venenatis tristique fusce congue diam id ornare imperdiet sapien urna pretium,in hac habitasse platea dictumst etiam faucibus cursus urna ut tellus nulla ut erat id mauris vulputate,4/17/2022,annually,10/11/2020,11/6/2022
63,4,12/18/2022,9/2/2020,warehouse,inactive,used,cum sociis natoque penatibus et magnis dis parturient montes nascetur ridiculus,morbi non quam nec dui luctus rutrum nulla tellus in sagittis dui vel,7/23/2028,quarterly,5/17/2020,9/22/2020
47,81,8/13/2021,3/2/2021,remote,pending,new,cras pellentesque volutpat dui maecenas tristique est et tempus semper est,maecenas ut massa quis augue luctus tincidunt nulla mollis molestie lorem quisque ut erat curabitur gravida nisi at,11/13/2027,annually,5/31/2020,1/13/2021
36,82,8/30/2021,7/3/2022,remote,inactive,used,convallis eget eleifend luctus ultricies eu nibh quisque id justo sit amet sapien dignissim vestibulum vestibulum ante,curae mauris viverra diam vitae quam suspendisse potenti nullam porttitor lacus at turpis donec posuere metus vitae ipsum aliquam,3/27/2025,monthly,10/13/2021,8/20/2020
76,16,4/14/2021,7/20/2022,office,active,used,vestibulum quam sapien varius ut blandit non interdum in ante vestibulum,elit ac nulla sed vel enim sit amet nunc viverra dapibus nulla suscipit ligula in lacus curabitur at,12/1/2026,annually,11/18/2021,7/12/2022
94,36,8/14/2021,4/4/2020,warehouse,inactive,used,aliquet ultrices erat tortor sollicitudin mi sit amet lobortis sapien sapien non mi integer ac neque duis bibendum morbi non,volutpat quam pede lobortis ligula sit amet eleifend pede libero quis orci nullam molestie nibh in lectus pellentesque at,8/31/2024,monthly,7/9/2022,11/18/2021
3,26,4/26/2020,7/18/2020,remote,active,used,at feugiat non pretium quis lectus suspendisse potenti in eleifend quam a odio in hac,sed augue aliquam erat volutpat in congue etiam justo etiam pretium iaculis justo in hac,12/11/2029,annually,10/27/2022,11/1/2022
72,39,12/30/2021,7/7/2020,warehouse,inactive,refurbished,tempus sit amet sem fusce consequat nulla nisl nunc nisl duis,aliquet massa id lobortis convallis tortor risus dapibus augue vel accumsan tellus nisi eu,10/15/2024,quarterly,8/17/2022,9/9/2021
86,73,2/22/2022,6/15/2022,remote,inactive,used,tincidunt lacus at velit vivamus vel nulla eget eros elementum pellentesque quisque porta volutpat erat quisque,at feugiat non pretium quis lectus suspendisse potenti in eleifend,12/4/2025,monthly,2/8/2022,11/11/2021
87,52,3/25/2022,10/9/2021,warehouse,pending,new,at nibh in hac habitasse platea dictumst aliquam augue quam,montes nascetur ridiculus mus vivamus vestibulum sagittis sapien cum sociis natoque penatibus et,1/2/2025,monthly,3/18/2022,12/10/2022
78,89,5/14/2022,4/28/2022,remote,pending,refurbished,justo in hac habitasse platea dictumst etiam faucibus cursus urna,sodales scelerisque mauris sit amet eros suspendisse accumsan tortor quis turpis sed ante vivamus tortor duis,11/24/2028,monthly,6/7/2020,10/26/2022
44,91,8/11/2020,10/29/2022,office,active,refurbished,nulla ut erat id mauris vulputate elementum nullam varius nulla facilisi cras non velit nec nisi vulputate nonummy maecenas tincidunt,eros viverra eget congue eget semper rutrum nulla nunc purus phasellus in felis donec semper sapien a libero nam,5/2/2022,quarterly,11/17/2021,2/7/2022
26,80,2/22/2020,9/17/2020,office,pending,used,nisi venenatis tristique fusce congue diam id ornare imperdiet sapien urna pretium nisl ut volutpat sapien arcu sed,ligula nec sem duis aliquam convallis nunc proin at turpis a pede posuere nonummy,5/26/2022,annually,11/1/2021,4/13/2022
13,81,8/10/2022,10/13/2021,office,active,used,id ornare imperdiet sapien urna pretium nisl ut volutpat sapien arcu sed augue aliquam erat volutpat in congue etiam,primis in faucibus orci luctus et ultrices posuere cubilia curae nulla dapibus dolor vel est,5/2/2023,quarterly,1/17/2021,10/15/2022
40,63,3/26/2022,1/21/2020,office,pending,new,eget semper rutrum nulla nunc purus phasellus in felis donec semper sapien a libero,mi in porttitor pede justo eu massa donec dapibus duis at velit eu,7/4/2029,monthly,4/10/2020,10/19/2020
85,34,8/11/2021,1/31/2020,remote,active,new,quam pede lobortis ligula sit amet eleifend pede libero quis,quam pharetra magna ac consequat metus sapien ut nunc vestibulum ante ipsum primis in faucibus orci luctus et ultrices,6/2/2026,monthly,3/18/2020,1/26/2020
10,45,3/24/2022,4/22/2022,office,active,new,est et tempus semper est quam pharetra magna ac consequat metus sapien ut nunc,proin risus praesent lectus vestibulum quam sapien varius ut blandit non interdum in ante vestibulum ante,10/21/2027,annually,5/24/2022,2/12/2022
97,4,12/28/2021,3/11/2021,warehouse,active,used,tellus nulla ut erat id mauris vulputate elementum nullam varius nulla facilisi cras,sit amet erat nulla tempus vivamus in felis eu sapien cursus vestibulum,12/16/2027,annually,6/29/2020,5/27/2020
34,30,8/24/2022,6/6/2020,warehouse,active,refurbished,nulla suspendisse potenti cras in purus eu magna vulputate luctus cum,cras in purus eu magna vulputate luctus cum sociis natoque penatibus et magnis dis parturient montes nascetur,12/1/2022,quarterly,5/5/2021,9/16/2020
74,90,3/5/2021,9/1/2020,warehouse,inactive,refurbished,sed lacus morbi sem mauris laoreet ut rhoncus aliquet pulvinar sed nisl nunc rhoncus dui vel sem sed sagittis,orci luctus et ultrices posuere cubilia curae donec pharetra magna vestibulum aliquet ultrices erat tortor,8/14/2025,quarterly,3/28/2020,5/18/2020
6,51,8/25/2022,10/8/2021,remote,active,refurbished,morbi vel lectus in quam fringilla rhoncus mauris enim leo rhoncus sed vestibulum sit amet cursus id turpis,mauris lacinia sapien quis libero nullam sit amet turpis elementum ligula vehicula consequat,1/10/2030,quarterly,1/12/2022,7/14/2021
64,4,5/12/2021,5/18/2022,office,inactive,new,tincidunt in leo maecenas pulvinar lobortis est phasellus sit amet erat nulla tempus vivamus in felis,vestibulum ante ipsum primis in faucibus orci luctus et ultrices posuere cubilia curae nulla dapibus,4/17/2023,monthly,12/24/2020,5/24/2022
28,54,7/15/2021,8/29/2020,office,pending,refurbished,praesent blandit nam nulla integer pede justo lacinia eget tincidunt eget tempus vel pede morbi porttitor,nulla nisl nunc nisl duis bibendum felis sed interdum venenatis,2/6/2024,quarterly,10/20/2020,3/3/2021
18,89,10/18/2022,12/14/2021,office,active,new,sapien placerat ante nulla justo aliquam quis turpis eget elit sodales scelerisque mauris sit amet eros suspendisse accumsan tortor,fusce lacus purus aliquet at feugiat non pretium quis lectus suspendisse potenti in eleifend quam a,11/14/2025,monthly,6/23/2022,5/1/2022
81,26,12/9/2021,5/29/2022,office,pending,refurbished,adipiscing elit proin interdum mauris non ligula pellentesque ultrices phasellus,sollicitudin vitae consectetuer eget rutrum at lorem integer tincidunt ante,3/31/2022,quarterly,3/18/2020,11/10/2022
30,43,1/14/2021,8/19/2022,office,pending,new,cursus vestibulum proin eu mi nulla ac enim in tempor turpis nec euismod scelerisque quam turpis adipiscing lorem vitae,consequat dui nec nisi volutpat eleifend donec ut dolor morbi vel lectus in quam fringilla rhoncus mauris enim,12/27/2030,quarterly,10/3/2022,2/14/2022
10,12,3/26/2021,3/13/2021,remote,inactive,used,morbi quis tortor id nulla ultrices aliquet maecenas leo odio condimentum id luctus nec molestie,turpis integer aliquet massa id lobortis convallis tortor risus dapibus augue vel,10/20/2023,quarterly,12/5/2022,3/3/2021
96,36,11/26/2020,5/3/2022,warehouse,pending,used,massa volutpat convallis morbi odio odio elementum eu interdum eu,lacinia eget tincidunt eget tempus vel pede morbi porttitor lorem id,5/6/2026,monthly,6/22/2021,1/13/2021
41,72,7/6/2022,8/22/2021,remote,pending,new,congue etiam justo etiam pretium iaculis justo in hac habitasse platea dictumst etiam faucibus cursus urna,diam erat fermentum justo nec condimentum neque sapien placerat ante nulla justo aliquam quis turpis eget,1/26/2025,quarterly,8/20/2020,2/29/2020
89,57,5/6/2020,12/12/2020,remote,inactive,refurbished,et ultrices posuere cubilia curae donec pharetra magna vestibulum aliquet ultrices erat tortor sollicitudin mi,consectetuer adipiscing elit proin risus praesent lectus vestibulum quam sapien varius ut blandit,1/4/2027,quarterly,2/25/2022,7/10/2021
57,95,3/8/2020,2/24/2020,office,inactive,refurbished,habitasse platea dictumst maecenas ut massa quis augue luctus tincidunt nulla mollis molestie,dis parturient montes nascetur ridiculus mus etiam vel augue vestibulum rutrum rutrum neque aenean auctor gravida sem praesent id massa,9/19/2030,monthly,2/7/2020,9/5/2022
41,28,10/27/2021,11/30/2020,office,inactive,new,ultricies eu nibh quisque id justo sit amet sapien dignissim vestibulum vestibulum,ipsum primis in faucibus orci luctus et ultrices posuere cubilia curae mauris viverra diam,4/14/2026,annually,7/4/2020,8/21/2020
88,85,1/8/2020,12/14/2022,warehouse,active,new,habitasse platea dictumst aliquam augue quam sollicitudin vitae consectetuer eget rutrum at lorem integer tincidunt ante,nisl nunc rhoncus dui vel sem sed sagittis nam congue risus semper porta volutpat quam pede lobortis ligula,12/31/2024,monthly,2/17/2022,12/23/2021
62,63,5/18/2022,11/12/2022,warehouse,pending,refurbished,est phasellus sit amet erat nulla tempus vivamus in felis eu sapien cursus vestibulum proin,neque vestibulum eget vulputate ut ultrices vel augue vestibulum ante ipsum primis in faucibus orci luctus et ultrices posuere cubilia,3/16/2029,monthly,12/27/2022,9/25/2020
44,27,4/8/2022,5/18/2022,office,active,used,ullamcorper purus sit amet nulla quisque arcu libero rutrum ac lobortis vel,mattis nibh ligula nec sem duis aliquam convallis nunc proin at turpis a pede posuere nonummy integer,6/18/2025,annually,1/21/2020,5/29/2021
14,79,9/16/2022,2/8/2020,remote,active,refurbished,molestie hendrerit at vulputate vitae nisl aenean lectus pellentesque eget nunc donec,etiam faucibus cursus urna ut tellus nulla ut erat id mauris vulputate elementum nullam varius nulla facilisi cras,8/10/2029,monthly,11/30/2020,2/28/2022
24,84,1/8/2022,9/11/2021,remote,inactive,new,aenean auctor gravida sem praesent id massa id nisl venenatis lacinia aenean,iaculis diam erat fermentum justo nec condimentum neque sapien placerat ante nulla justo aliquam quis turpis eget elit sodales,7/19/2027,monthly,6/25/2020,4/11/2020
63,88,3/13/2020,12/18/2020,warehouse,inactive,refurbished,sit amet consectetuer adipiscing elit proin interdum mauris non ligula pellentesque ultrices phasellus id sapien,aliquam augue quam sollicitudin vitae consectetuer eget rutrum at lorem integer tincidunt ante vel,3/5/2027,quarterly,6/25/2020,3/18/2022
10,67,6/19/2021,2/28/2021,office,inactive,new,non mauris morbi non lectus aliquam sit amet diam in magna bibendum imperdiet nullam,at nulla suspendisse potenti cras in purus eu magna vulputate luctus cum sociis natoque penatibus et magnis,8/31/2025,quarterly,7/10/2021,5/14/2020
54,5,5/11/2020,11/14/2021,warehouse,inactive,used,vitae nisl aenean lectus pellentesque eget nunc donec quis orci eget orci vehicula condimentum curabitur in libero ut,vulputate ut ultrices vel augue vestibulum ante ipsum primis in faucibus orci luctus et ultrices posuere cubilia curae donec pharetra,5/7/2022,monthly,5/11/2021,8/26/2020
59,34,1/14/2022,6/4/2022,office,inactive,new,quisque id justo sit amet sapien dignissim vestibulum vestibulum ante ipsum primis in,lacinia aenean sit amet justo morbi ut odio cras mi pede,1/12/2028,monthly,1/4/2021,10/15/2021
35,11,5/7/2020,6/3/2020,remote,pending,used,sociis natoque penatibus et magnis dis parturient montes nascetur ridiculus mus etiam vel augue vestibulum rutrum rutrum neque aenean auctor,pede justo lacinia eget tincidunt eget tempus vel pede morbi,9/22/2030,monthly,3/9/2020,10/2/2020
83,45,12/16/2021,4/7/2022,warehouse,pending,new,eros vestibulum ac est lacinia nisi venenatis tristique fusce congue diam id ornare imperdiet sapien urna,scelerisque mauris sit amet eros suspendisse accumsan tortor quis turpis sed ante vivamus tortor duis mattis egestas metus,1/1/2023,annually,5/11/2020,9/6/2021
40,44,1/25/2020,5/5/2021,remote,inactive,new,est quam pharetra magna ac consequat metus sapien ut nunc vestibulum ante ipsum,interdum mauris non ligula pellentesque ultrices phasellus id sapien in sapien iaculis congue vivamus metus arcu adipiscing molestie hendrerit at,10/17/2030,monthly,7/5/2020,10/6/2020
7,56,2/5/2021,7/28/2020,office,pending,refurbished,mollis molestie lorem quisque ut erat curabitur gravida nisi at nibh in hac habitasse platea dictumst,primis in faucibus orci luctus et ultrices posuere cubilia curae donec pharetra,11/11/2028,annually,9/4/2022,7/19/2020
8,26,11/30/2021,7/9/2020,remote,active,new,duis faucibus accumsan odio curabitur convallis duis consequat dui nec nisi volutpat eleifend donec ut dolor morbi,ipsum ac tellus semper interdum mauris ullamcorper purus sit amet nulla quisque,11/16/2026,monthly,2/15/2020,9/16/2022
47,81,5/11/2020,12/7/2021,warehouse,inactive,refurbished,pede ac diam cras pellentesque volutpat dui maecenas tristique est et tempus semper,augue vestibulum rutrum rutrum neque aenean auctor gravida sem praesent id massa id nisl venenatis lacinia aenean,3/3/2029,quarterly,10/4/2021,3/5/2020
