employee_id,asset_id,assigned_date,return_date,location,status,condition,serial_number,model_number,warranty_expiration,maintenance_schedule,maintenance_last_date,maintenance_next_date
16,5,9/7/2020,1/5/2020,office,inactive,refurbished,mauris ullamcorper purus sit amet nulla quisque arcu libero rutrum ac lobortis vel dapibus,consectetuer eget rutrum at lorem integer tincidunt ante vel ipsum praesent blandit lacinia erat vestibulum sed magna at,11/9/2029,annually,5/22/2020,10/14/2020
29,83,3/30/2022,1/13/2020,remote,inactive,used,tempus semper est quam pharetra magna ac consequat metus sapien ut nunc vestibulum ante ipsum primis in,quisque erat eros viverra eget congue eget semper rutrum nulla nunc purus phasellus in,9/1/2024,quarterly,4/29/2020,6/11/2022
2,72,4/16/2020,3/7/2020,office,active,refurbished,urna ut tellus nulla ut erat id mauris vulputate elementum nullam varius,enim lorem ipsum dolor sit amet consectetuer adipiscing elit proin interdum mauris non ligula pellentesque ultrices,4/23/2023,monthly,5/8/2022,11/28/2020
98,79,3/23/2020,2/12/2020,remote,active,new,faucibus orci luctus et ultrices posuere cubilia curae mauris viverra diam vitae quam suspendisse,lorem integer tincidunt ante vel ipsum praesent blandit lacinia erat vestibulum sed magna at nunc commodo placerat praesent blandit,9/18/2023,quarterly,7/9/2022,12/15/2022
64,28,7/21/2022,7/10/2021,office,active,used,sed justo pellentesque viverra pede ac diam cras pellentesque volutpat dui maecenas tristique est et tempus,vivamus vel nulla eget eros elementum pellentesque quisque porta volutpat erat quisque erat eros viverra eget,8/28/2027,monthly,11/19/2021,2/16/2022
60,15,2/28/2022,3/4/2020,remote,inactive,refurbished,mus etiam vel augue vestibulum rutrum rutrum neque aenean auctor gravida sem praesent id massa id nisl venenatis,ornare consequat lectus in est risus auctor sed tristique in tempus,10/18/2022,quarterly,5/17/2021,4/27/2022
5,57,5/16/2020,9/10/2022,remote,active,refurbished,turpis donec posuere metus vitae ipsum aliquam non mauris morbi non lectus aliquam sit,vivamus vestibulum sagittis sapien cum sociis natoque penatibus et magnis dis parturient montes,4/22/2029,annually,7/1/2020,11/16/2020
57,30,7/4/2022,6/10/2021,warehouse,active,new,est congue elementum in hac habitasse platea dictumst morbi vestibulum velit id pretium iaculis diam erat fermentum justo nec,in sapien iaculis congue vivamus metus arcu adipiscing molestie hendrerit at vulputate vitae,8/9/2023,monthly,2/8/2021,7/16/2021
67,14,5/26/2020,4/3/2022,warehouse,pending,new,primis in faucibus orci luctus et ultrices posuere cubilia curae duis faucibus,venenatis non sodales sed tincidunt eu felis fusce posuere felis sed lacus morbi sem mauris,12/9/2028,annually,6/30/2022,4/18/2022
46,75,10/2/2020,8/11/2022,warehouse,inactive,used,libero quis orci nullam molestie nibh in lectus pellentesque at nulla,ultrices erat tortor sollicitudin mi sit amet lobortis sapien sapien non mi integer ac neque duis bibendum morbi non quam,10/11/2026,annually,2/3/2021,1/20/2021
55,47,8/31/2021,11/23/2022,remote,inactive,used,nibh in quis justo maecenas rhoncus aliquam lacus morbi quis tortor id nulla ultrices aliquet maecenas leo odio condimentum,enim blandit mi in porttitor pede justo eu massa donec,5/12/2029,monthly,8/10/2021,5/3/2020
1,9,2/9/2022,2/22/2020,office,pending,refurbished,vestibulum ante ipsum primis in faucibus orci luctus et ultrices posuere cubilia,curabitur at ipsum ac tellus semper interdum mauris ullamcorper purus sit,6/27/2027,quarterly,11/25/2021,2/16/2022
59,36,8/5/2021,5/13/2021,remote,inactive,refurbished,primis in faucibus orci luctus et ultrices posuere cubilia curae duis faucibus accumsan odio curabitur convallis duis,cursus id turpis integer aliquet massa id lobortis convallis tortor risus,1/24/2024,annually,3/14/2020,10/24/2022
41,90,12/21/2020,3/17/2021,remote,active,refurbished,at velit eu est congue elementum in hac habitasse platea dictumst morbi vestibulum velit id,pede morbi porttitor lorem id ligula suspendisse ornare consequat lectus in est risus auctor sed tristique in tempus sit,11/27/2026,monthly,7/22/2020,12/7/2021
98,31,2/9/2020,10/14/2020,remote,inactive,used,nulla facilisi cras non velit nec nisi vulputate nonummy maecenas tincidunt lacus at velit,eget massa tempor convallis nulla neque libero convallis eget eleifend luctus ultricies eu nibh quisque id justo sit amet sapien,7/31/2023,quarterly,4/13/2022,7/9/2021
63,93,4/27/2021,5/25/2021,warehouse,pending,used,vitae consectetuer eget rutrum at lorem integer tincidunt ante vel ipsum praesent blandit lacinia,nullam molestie nibh in lectus pellentesque at nulla suspendisse potenti cras in purus eu magna vulputate luctus cum,4/24/2026,monthly,12/19/2022,4/13/2021
56,75,10/13/2022,10/25/2020,remote,active,new,in leo maecenas pulvinar lobortis est phasellus sit amet erat nulla tempus vivamus,arcu sed augue aliquam erat volutpat in congue etiam justo etiam pretium iaculis justo in hac habitasse platea,8/8/2027,annually,3/17/2021,4/27/2022
24,75,11/20/2022,5/26/2021,warehouse,pending,new,molestie hendrerit at vulputate vitae nisl aenean lectus pellentesque eget nunc donec quis orci eget orci vehicula condimentum curabitur in,ut blandit non interdum in ante vestibulum ante ipsum primis in faucibus orci luctus et ultrices posuere cubilia,1/12/2029,monthly,5/17/2021,7/29/2021
92,14,12/23/2022,7/14/2021,remote,active,new,ut rhoncus aliquet pulvinar sed nisl nunc rhoncus dui vel sem sed sagittis nam congue risus semper porta volutpat quam,nulla ut erat id mauris vulputate elementum nullam varius nulla facilisi cras non velit nec nisi vulputate nonummy maecenas tincidunt,5/5/2023,annually,1/17/2021,11/20/2022
65,96,12/6/2021,8/25/2021,remote,active,used,libero quis orci nullam molestie nibh in lectus pellentesque at nulla suspendisse potenti cras in purus eu magna vulputate,in faucibus orci luctus et ultrices posuere cubilia curae duis faucibus accumsan odio curabitur convallis duis consequat dui,7/30/2023,annually,5/29/2020,7/3/2021
34,79,8/10/2020,1/5/2020,warehouse,inactive,used,maecenas ut massa quis augue luctus tincidunt nulla mollis molestie lorem quisque ut,purus sit amet nulla quisque arcu libero rutrum ac lobortis vel dapibus at diam nam,4/18/2028,quarterly,7/17/2022,5/20/2020
29,6,8/3/2021,3/7/2020,warehouse,inactive,used,ultrices libero non mattis pulvinar nulla pede ullamcorper augue a suscipit nulla elit ac,ligula vehicula consequat morbi a ipsum integer a nibh in quis justo maecenas rhoncus aliquam lacus morbi,1/8/2022,monthly,7/7/2021,12/5/2022
44,22,3/4/2022,2/18/2022,warehouse,inactive,new,in hac habitasse platea dictumst morbi vestibulum velit id pretium,in blandit ultrices enim lorem ipsum dolor sit amet consectetuer adipiscing elit proin interdum mauris,8/16/2028,monthly,11/12/2021,12/19/2021
8,48,7/15/2020,8/3/2021,office,inactive,new,mauris lacinia sapien quis libero nullam sit amet turpis elementum ligula vehicula consequat morbi a ipsum integer,eget rutrum at lorem integer tincidunt ante vel ipsum praesent blandit lacinia,7/16/2029,monthly,6/1/2021,8/24/2021
80,95,4/21/2020,10/6/2022,office,active,used,justo in blandit ultrices enim lorem ipsum dolor sit amet consectetuer adipiscing elit proin interdum mauris non ligula,vestibulum ante ipsum primis in faucibus orci luctus et ultrices posuere cubilia curae,4/13/2024,monthly,2/15/2022,6/16/2022
69,2,9/3/2022,6/28/2022,office,inactive,new,hac habitasse platea dictumst maecenas ut massa quis augue luctus tincidunt nulla,vivamus metus arcu adipiscing molestie hendrerit at vulputate vitae nisl aenean lectus pellentesque eget nunc donec quis,5/2/2030,quarterly,12/23/2020,6/2/2020
46,18,8/4/2021,6/8/2020,warehouse,inactive,new,justo sit amet sapien dignissim vestibulum vestibulum ante ipsum primis in faucibus orci luctus et ultrices posuere cubilia curae,accumsan tellus nisi eu orci mauris lacinia sapien quis libero nullam sit amet turpis elementum ligula vehicula,5/12/2027,annually,7/10/2022,12/2/2021
69,37,2/21/2020,4/19/2022,office,pending,refurbished,convallis nunc proin at turpis a pede posuere nonummy integer non velit,eu est congue elementum in hac habitasse platea dictumst morbi vestibulum velit id pretium iaculis diam erat fermentum justo nec,7/30/2029,monthly,9/28/2021,10/21/2020
41,16,4/15/2020,11/23/2022,remote,pending,refurbished,penatibus et magnis dis parturient montes nascetur ridiculus mus vivamus vestibulum sagittis sapien cum sociis natoque,lectus suspendisse potenti in eleifend quam a odio in hac habitasse platea dictumst maecenas,6/24/2026,monthly,9/25/2022,5/14/2021
34,59,11/27/2021,11/3/2022,warehouse,inactive,refurbished,eros suspendisse accumsan tortor quis turpis sed ante vivamus tortor duis mattis egestas metus aenean fermentum,dictumst etiam faucibus cursus urna ut tellus nulla ut erat id mauris vulputate elementum nullam varius,2/4/2023,monthly,8/28/2022,4/22/2020
32,9,5/19/2021,10/12/2020,remote,active,new,dolor sit amet consectetuer adipiscing elit proin interdum mauris non ligula pellentesque ultrices phasellus,magna bibendum imperdiet nullam orci pede venenatis non sodales sed tincidunt eu felis fusce posuere felis sed,6/9/2023,annually,3/18/2022,11/16/2022
60,9,12/18/2022,3/26/2021,warehouse,inactive,refurbished,curae donec pharetra magna vestibulum aliquet ultrices erat tortor sollicitudin mi sit,sed tristique in tempus sit amet sem fusce consequat nulla nisl,1/28/2023,annually,9/19/2022,6/11/2020
43,84,2/12/2021,12/22/2020,office,inactive,refurbished,enim in tempor turpis nec euismod scelerisque quam turpis adipiscing lorem vitae mattis nibh ligula nec sem duis aliquam convallis,curabitur in libero ut massa volutpat convallis morbi odio odio elementum eu interdum eu tincidunt in leo maecenas,10/1/2027,quarterly,1/5/2022,6/22/2022
80,75,12/31/2020,11/1/2022,office,active,refurbished,at vulputate vitae nisl aenean lectus pellentesque eget nunc donec quis orci,morbi vestibulum velit id pretium iaculis diam erat fermentum justo nec,5/25/2028,annually,1/31/2020,1/18/2022
75,89,12/11/2021,10/24/2021,remote,active,new,libero nullam sit amet turpis elementum ligula vehicula consequat morbi a,felis sed interdum venenatis turpis enim blandit mi in porttitor pede justo eu massa donec dapibus duis,6/10/2026,monthly,3/5/2022,12/10/2022
83,34,6/12/2022,7/15/2020,warehouse,active,used,volutpat eleifend donec ut dolor morbi vel lectus in quam fringilla rhoncus mauris enim leo,faucibus cursus urna ut tellus nulla ut erat id mauris vulputate elementum nullam varius nulla facilisi,5/19/2026,monthly,5/1/2022,7/19/2020
16,86,9/12/2020,2/23/2020,warehouse,pending,refurbished,morbi sem mauris laoreet ut rhoncus aliquet pulvinar sed nisl nunc rhoncus dui,urna pretium nisl ut volutpat sapien arcu sed augue aliquam erat volutpat in congue,8/11/2028,monthly,12/23/2022,10/21/2022
23,38,12/30/2021,6/18/2022,warehouse,inactive,refurbished,odio curabitur convallis duis consequat dui nec nisi volutpat eleifend donec ut,vel augue vestibulum ante ipsum primis in faucibus orci luctus et ultrices posuere cubilia,2/5/2022,annually,9/10/2021,8/14/2022
98,74,4/15/2021,6/23/2022,office,active,refurbished,viverra eget congue eget semper rutrum nulla nunc purus phasellus in felis donec,morbi quis tortor id nulla ultrices aliquet maecenas leo odio condimentum id luctus nec molestie sed justo,10/21/2027,quarterly,10/18/2020,1/28/2020
91,56,1/23/2020,7/1/2021,remote,active,new,purus phasellus in felis donec semper sapien a libero nam dui proin,placerat praesent blandit nam nulla integer pede justo lacinia eget tincidunt eget tempus,2/4/2029,quarterly,6/10/2022,4/30/2021
99,65,10/24/2020,10/13/2021,office,inactive,new,sapien non mi integer ac neque duis bibendum morbi non quam nec dui,ac nibh fusce lacus purus aliquet at feugiat non pretium quis lectus suspendisse potenti in,1/2/2022,annually,4/11/2021,10/29/2020
89,80,6/17/2022,12/15/2021,warehouse,inactive,new,est quam pharetra magna ac consequat metus sapien ut nunc,quis turpis eget elit sodales scelerisque mauris sit amet eros suspendisse,1/22/2024,annually,11/30/2021,7/25/2020
73,64,10/1/2022,10/17/2020,remote,inactive,refurbished,justo aliquam quis turpis eget elit sodales scelerisque mauris sit amet eros suspendisse accumsan tortor,diam erat fermentum justo nec condimentum neque sapien placerat ante nulla justo,12/29/2028,annually,2/15/2020,12/9/2021
13,84,2/4/2021,4/29/2020,warehouse,active,refurbished,in libero ut massa volutpat convallis morbi odio odio elementum eu interdum eu,tincidunt in leo maecenas pulvinar lobortis est phasellus sit amet erat nulla tempus vivamus in felis eu,1/21/2024,annually,6/10/2020,7/7/2021
3,98,4/13/2020,1/15/2020,remote,inactive,refurbished,luctus ultricies eu nibh quisque id justo sit amet sapien dignissim vestibulum vestibulum ante ipsum primis in faucibus orci luctus,scelerisque mauris sit amet eros suspendisse accumsan tortor quis turpis sed ante,12/11/2029,quarterly,10/10/2021,7/3/2020
22,72,1/5/2020,6/15/2020,office,pending,refurbished,habitasse platea dictumst etiam faucibus cursus urna ut tellus nulla ut erat id,eu sapien cursus vestibulum proin eu mi nulla ac enim,3/22/2029,quarterly,11/6/2020,4/1/2021
32,17,4/22/2020,6/14/2021,warehouse,active,used,eget eros elementum pellentesque quisque porta volutpat erat quisque erat eros viverra eget congue eget semper rutrum nulla nunc,nulla justo aliquam quis turpis eget elit sodales scelerisque mauris sit amet eros suspendisse accumsan tortor,2/9/2024,quarterly,7/10/2020,2/14/2020
58,45,7/15/2021,12/22/2020,warehouse,pending,refurbished,justo aliquam quis turpis eget elit sodales scelerisque mauris sit amet eros,orci luctus et ultrices posuere cubilia curae mauris viverra diam vitae quam,2/1/2023,monthly,7/4/2020,7/28/2021
47,10,8/20/2022,3/16/2021,remote,inactive,refurbished,proin eu mi nulla ac enim in tempor turpis nec euismod scelerisque quam turpis adipiscing lorem,tincidunt ante vel ipsum praesent blandit lacinia erat vestibulum sed,2/10/2025,monthly,6/3/2020,12/12/2021
18,14,5/31/2022,3/8/2021,remote,inactive,new,nulla justo aliquam quis turpis eget elit sodales scelerisque mauris sit amet eros suspendisse accumsan tortor,blandit lacinia erat vestibulum sed magna at nunc commodo placerat praesent blandit nam nulla integer pede justo lacinia,7/23/2027,quarterly,2/25/2022,1/24/2020
94,16,6/26/2022,3/18/2020,warehouse,active,refurbished,viverra eget congue eget semper rutrum nulla nunc purus phasellus in felis donec semper sapien,dictumst morbi vestibulum velit id pretium iaculis diam erat fermentum justo nec condimentum neque sapien placerat ante nulla,12/10/2028,annually,7/17/2020,4/19/2020
46,14,9/1/2021,5/4/2020,warehouse,pending,new,amet lobortis sapien sapien non mi integer ac neque duis bibendum morbi non quam nec dui luctus rutrum,et eros vestibulum ac est lacinia nisi venenatis tristique fusce,8/18/2027,annually,4/19/2022,3/20/2022
7,45,3/29/2021,7/18/2022,remote,pending,used,lacus at velit vivamus vel nulla eget eros elementum pellentesque quisque porta volutpat erat quisque erat eros viverra eget congue,pede justo lacinia eget tincidunt eget tempus vel pede morbi porttitor lorem id ligula,2/22/2022,annually,5/25/2021,10/24/2020
20,85,5/21/2022,3/27/2020,remote,inactive,used,dui vel nisl duis ac nibh fusce lacus purus aliquet at feugiat non,sem sed sagittis nam congue risus semper porta volutpat quam pede lobortis,10/18/2023,annually,11/9/2020,3/13/2021
98,63,3/31/2022,2/21/2022,office,inactive,refurbished,vestibulum velit id pretium iaculis diam erat fermentum justo nec condimentum neque sapien,consequat ut nulla sed accumsan felis ut at dolor quis odio consequat varius integer ac leo pellentesque ultrices,4/26/2029,quarterly,11/9/2020,11/29/2022
54,96,8/20/2021,6/16/2020,office,pending,new,quam a odio in hac habitasse platea dictumst maecenas ut massa quis augue luctus,vel accumsan tellus nisi eu orci mauris lacinia sapien quis,5/10/2025,quarterly,12/3/2020,11/7/2022
32,60,11/23/2021,11/7/2021,office,pending,new,vestibulum vestibulum ante ipsum primis in faucibus orci luctus et ultrices posuere,vitae quam suspendisse potenti nullam porttitor lacus at turpis donec posuere metus vitae ipsum aliquam non mauris morbi,6/8/2022,quarterly,1/23/2022,10/26/2020
52,38,6/21/2022,2/22/2022,remote,inactive,new,felis donec semper sapien a libero nam dui proin leo odio porttitor id consequat in consequat ut nulla sed accumsan,interdum eu tincidunt in leo maecenas pulvinar lobortis est phasellus sit amet erat,12/17/2024,monthly,11/24/2020,9/13/2022
17,9,10/12/2021,3/18/2021,office,pending,used,orci mauris lacinia sapien quis libero nullam sit amet turpis elementum ligula,odio porttitor id consequat in consequat ut nulla sed accumsan felis ut at dolor quis odio consequat varius integer ac,9/17/2022,annually,5/8/2020,11/16/2020
37,96,10/20/2021,3/21/2022,office,inactive,new,massa id lobortis convallis tortor risus dapibus augue vel accumsan tellus nisi eu orci mauris lacinia,mauris non ligula pellentesque ultrices phasellus id sapien in sapien iaculis congue vivamus metus arcu adipiscing molestie hendrerit at vulputate,4/6/2024,monthly,3/13/2022,3/2/2020
63,21,2/4/2022,10/4/2022,remote,active,new,nonummy integer non velit donec diam neque vestibulum eget vulputate ut ultrices,odio curabitur convallis duis consequat dui nec nisi volutpat eleifend donec ut,4/26/2028,monthly,5/17/2021,4/13/2021
37,12,7/21/2020,9/11/2022,warehouse,inactive,new,sapien varius ut blandit non interdum in ante vestibulum ante ipsum primis in faucibus orci luctus et ultrices posuere cubilia,vehicula condimentum curabitur in libero ut massa volutpat convallis morbi odio odio elementum eu interdum eu tincidunt in leo,4/7/2028,monthly,3/30/2022,10/2/2021
62,63,8/7/2022,11/8/2020,remote,active,new,vestibulum ac est lacinia nisi venenatis tristique fusce congue diam id ornare imperdiet sapien urna pretium,mus vivamus vestibulum sagittis sapien cum sociis natoque penatibus et magnis dis,6/9/2026,quarterly,2/15/2020,8/19/2021
36,19,9/14/2020,3/10/2021,office,pending,new,at turpis a pede posuere nonummy integer non velit donec diam neque vestibulum eget vulputate ut,vehicula condimentum curabitur in libero ut massa volutpat convallis morbi odio,3/26/2023,monthly,7/14/2021,6/10/2020
7,51,2/23/2020,1/25/2021,remote,inactive,used,sit amet consectetuer adipiscing elit proin risus praesent lectus vestibulum,cubilia curae donec pharetra magna vestibulum aliquet ultrices erat tortor sollicitudin mi sit amet lobortis sapien,2/18/2022,annually,2/1/2022,4/13/2022
80,21,4/16/2021,3/8/2020,office,pending,new,magna at nunc commodo placerat praesent blandit nam nulla integer pede justo lacinia eget tincidunt eget,sed magna at nunc commodo placerat praesent blandit nam nulla integer pede justo lacinia eget tincidunt eget tempus,7/6/2029,monthly,4/22/2022,11/5/2020
2,86,7/5/2020,10/3/2021,remote,pending,used,sit amet turpis elementum ligula vehicula consequat morbi a ipsum integer,venenatis non sodales sed tincidunt eu felis fusce posuere felis sed lacus morbi sem mauris laoreet ut rhoncus,4/17/2025,quarterly,6/17/2020,2/26/2022
34,81,4/5/2022,8/2/2020,warehouse,inactive,refurbished,hac habitasse platea dictumst maecenas ut massa quis augue luctus tincidunt nulla mollis molestie lorem quisque,viverra pede ac diam cras pellentesque volutpat dui maecenas tristique est et tempus semper est quam pharetra magna,9/20/2029,quarterly,10/25/2022,9/10/2020
1,31,1/3/2020,6/22/2022,remote,inactive,refurbished,morbi vel lectus in quam fringilla rhoncus mauris enim leo rhoncus,congue diam id ornare imperdiet sapien urna pretium nisl ut volutpat sapien arcu,4/25/2027,quarterly,12/16/2020,2/12/2021
33,38,11/16/2021,1/17/2022,warehouse,inactive,used,amet consectetuer adipiscing elit proin risus praesent lectus vestibulum quam,sit amet consectetuer adipiscing elit proin interdum mauris non ligula pellentesque ultrices phasellus id sapien in sapien iaculis congue,6/21/2026,annually,8/27/2020,12/10/2021
42,46,11/2/2020,3/14/2022,warehouse,pending,new,nullam sit amet turpis elementum ligula vehicula consequat morbi a ipsum integer,lacinia eget tincidunt eget tempus vel pede morbi porttitor lorem id ligula suspendisse ornare,7/9/2030,monthly,3/9/2022,10/14/2020
10,15,5/3/2021,10/20/2021,warehouse,inactive,new,dictumst morbi vestibulum velit id pretium iaculis diam erat fermentum justo nec condimentum neque sapien placerat ante nulla justo aliquam,vel est donec odio justo sollicitudin ut suscipit a feugiat et,3/5/2024,monthly,3/2/2020,12/10/2022
100,59,8/8/2022,4/1/2022,remote,pending,new,nam dui proin leo odio porttitor id consequat in consequat ut nulla sed accumsan felis ut at dolor quis,ultrices phasellus id sapien in sapien iaculis congue vivamus metus arcu adipiscing molestie hendrerit at vulputate vitae nisl aenean lectus,7/16/2028,quarterly,10/15/2021,8/29/2022
43,48,12/28/2022,1/11/2021,remote,pending,refurbished,amet lobortis sapien sapien non mi integer ac neque duis bibendum morbi non quam,eu interdum eu tincidunt in leo maecenas pulvinar lobortis est phasellus sit amet erat nulla tempus vivamus,2/1/2024,monthly,6/23/2022,5/13/2022
97,7,10/11/2021,11/4/2021,remote,active,used,amet lobortis sapien sapien non mi integer ac neque duis bibendum morbi non quam nec dui luctus rutrum nulla tellus,dis parturient montes nascetur ridiculus mus vivamus vestibulum sagittis sapien cum sociis natoque penatibus et,8/10/2030,annually,6/30/2022,4/10/2020
76,33,10/19/2020,4/5/2022,remote,active,refurbished,amet justo morbi ut odio cras mi pede malesuada in imperdiet et,ut mauris eget massa tempor convallis nulla neque libero convallis eget eleifend luctus ultricies eu,4/30/2027,quarterly,6/24/2020,5/18/2021
42,29,6/24/2020,9/30/2020,warehouse,inactive,used,quam suspendisse potenti nullam porttitor lacus at turpis donec posuere,sapien urna pretium nisl ut volutpat sapien arcu sed augue aliquam erat volutpat in congue etiam,1/31/2027,quarterly,7/19/2021,9/12/2021
54,12,2/19/2020,1/4/2020,warehouse,pending,new,sollicitudin ut suscipit a feugiat et eros vestibulum ac est lacinia nisi venenatis tristique fusce congue,ut ultrices vel augue vestibulum ante ipsum primis in faucibus,12/14/2024,annually,12/1/2020,7/22/2020
94,23,9/11/2022,9/12/2020,warehouse,inactive,new,vel lectus in quam fringilla rhoncus mauris enim leo rhoncus sed vestibulum sit amet cursus id turpis integer aliquet,in tempus sit amet sem fusce consequat nulla nisl nunc nisl duis bibendum felis sed interdum venenatis turpis enim,8/2/2027,annually,1/31/2020,10/22/2022
92,46,5/12/2022,6/27/2022,remote,inactive,used,justo eu massa donec dapibus duis at velit eu est congue elementum in hac habitasse platea,neque vestibulum eget vulputate ut ultrices vel augue vestibulum ante ipsum,3/14/2026,annually,6/22/2021,5/6/2020
5,12,1/17/2021,4/29/2020,warehouse,active,refurbished,sit amet sem fusce consequat nulla nisl nunc nisl duis bibendum felis,nulla elit ac nulla sed vel enim sit amet nunc viverra dapibus nulla suscipit ligula,2/21/2025,quarterly,10/5/2020,7/3/2020
64,86,11/16/2021,4/2/2020,warehouse,active,used,pede justo eu massa donec dapibus duis at velit eu est congue elementum in hac habitasse,hendrerit at vulputate vitae nisl aenean lectus pellentesque eget nunc donec quis orci eget orci vehicula condimentum curabitur in libero,2/4/2026,annually,7/17/2020,4/13/2020
80,19,12/12/2020,2/7/2021,remote,active,new,hendrerit at vulputate vitae nisl aenean lectus pellentesque eget nunc donec quis orci eget orci vehicula,libero quis orci nullam molestie nibh in lectus pellentesque at,2/7/2024,quarterly,9/12/2022,3/31/2022
59,92,12/14/2022,9/8/2022,warehouse,active,refurbished,at velit eu est congue elementum in hac habitasse platea dictumst morbi,nibh fusce lacus purus aliquet at feugiat non pretium quis lectus suspendisse potenti in eleifend quam,10/21/2024,quarterly,6/14/2022,1/12/2021
54,31,5/25/2021,9/26/2020,warehouse,inactive,new,neque libero convallis eget eleifend luctus ultricies eu nibh quisque id justo sit amet sapien,ut at dolor quis odio consequat varius integer ac leo pellentesque ultrices mattis odio donec,7/5/2022,monthly,4/28/2020,5/4/2022
83,99,10/13/2021,8/25/2020,remote,inactive,new,pellentesque viverra pede ac diam cras pellentesque volutpat dui maecenas tristique est et tempus semper,a libero nam dui proin leo odio porttitor id consequat in consequat ut nulla sed accumsan felis,3/29/2028,annually,8/5/2022,9/26/2022
89,25,8/21/2022,12/29/2021,warehouse,pending,used,ipsum aliquam non mauris morbi non lectus aliquam sit amet diam,quam fringilla rhoncus mauris enim leo rhoncus sed vestibulum sit amet cursus id turpis integer aliquet,8/1/2023,quarterly,11/22/2022,2/14/2021
70,96,6/18/2020,11/23/2020,remote,active,refurbished,pellentesque viverra pede ac diam cras pellentesque volutpat dui maecenas tristique est et tempus semper est quam,consequat ut nulla sed accumsan felis ut at dolor quis odio consequat varius integer ac,4/26/2028,annually,11/19/2021,2/15/2021
21,25,12/7/2022,10/1/2020,remote,pending,new,nam ultrices libero non mattis pulvinar nulla pede ullamcorper augue a,ut rhoncus aliquet pulvinar sed nisl nunc rhoncus dui vel sem sed sagittis nam congue risus semper porta volutpat,6/7/2026,annually,1/21/2022,9/26/2021
19,90,10/29/2021,2/11/2021,warehouse,active,used,aliquam erat volutpat in congue etiam justo etiam pretium iaculis justo in hac habitasse platea dictumst etiam,posuere cubilia curae mauris viverra diam vitae quam suspendisse potenti nullam porttitor lacus at turpis donec posuere metus vitae,10/12/2029,monthly,11/17/2022,1/7/2021
100,27,4/10/2021,4/22/2021,office,active,refurbished,proin at turpis a pede posuere nonummy integer non velit donec,sed vestibulum sit amet cursus id turpis integer aliquet massa id lobortis convallis tortor risus,1/15/2027,quarterly,3/18/2021,5/2/2020
